{
  "schema_version": 1,
  "benchmark_suite_version": "v1.0",
  "environment": {
    "gpu": "NVIDIA GeForce RTX 5070 Laptop GPU",
    "driver": "592.01",
    "os": "Windows-10-10.0.26200-SP0",
    "python": "3.10.20",
    "pytorch": "2.12.1+cu130",
    "cuda_runtime": "13.0",
    "gsplat_version": "1.4.0+pt21cu118",
    "gpu_clocks_locked": false,
    "gsplat_extension_dir": "C:\\Users\\36570\\3dgs-renderer-benchmark\\results\\task_b_gsplat_build\\gsplat_cuda",
    "gsplat_source_dir": "C:\\Users\\36570\\Documents\\Codex\\2026-07-13\\zhe\\sources\\gsplat",
    "gsplat_scene_extension_dir": "C:\\Users\\36570\\AppData\\Local\\torch_extensions\\torch_extensions\\Cache\\py310_cu130\\gsplat_scene_cuda",
    "gsplat_inference_extension_dir": "C:\\Users\\36570\\AppData\\Local\\torch_extensions\\torch_extensions\\Cache\\py310_cu130\\experimental_gaussian_render_inference_scene_cuda"
  },
  "protocol": {
    "scenes": [
      "garden",
      "bicycle",
      "room"
    ],
    "resolutions": [
      "720p",
      "1080p",
      "4k"
    ],
    "warmup_frames": 10,
    "measured_frames_per_repeat": 30,
    "repeats": 3,
    "source_documents": 9
  },
  "records": [
    {
      "scene_id": "garden",
      "renderer": "gsplat_higs_auto",
      "resolution_name": "720p",
      "width": 1280,
      "height": 720,
      "mean_fps": 258.7,
      "mean_latency_ms": 3.8656666666666655,
      "p99_latency_ms": 4.6497,
      "peak_vram_mb": 2591.3,
      "stability_score": 0.8204830419166828,
      "source_json": "data\\results\\mipnerf360_garden_720p_2026-07-15\\benchmark_results.json"
    },
    {
      "scene_id": "garden",
      "renderer": "gsplat_higs_auto",
      "resolution_name": "1080p",
      "width": 1920,
      "height": 1080,
      "mean_fps": 236.5,
      "mean_latency_ms": 4.227555555555554,
      "p99_latency_ms": 7.0128999999999975,
      "peak_vram_mb": 2619.8,
      "stability_score": 0.5710904190848296,
      "source_json": "data\\results\\mipnerf360_garden_1080p_2026-07-15\\benchmark_results.json"
    },
    {
      "scene_id": "garden",
      "renderer": "gsplat_higs_auto",
      "resolution_name": "4k",
      "width": 3840,
      "height": 2160,
      "mean_fps": 139.9,
      "mean_latency_ms": 7.146777777777779,
      "p99_latency_ms": 8.0977,
      "peak_vram_mb": 2759.3,
      "stability_score": 0.8774096348345828,
      "source_json": "data\\results\\mipnerf360_garden_4k_2026-07-15\\benchmark_results.json"
    },
    {
      "scene_id": "garden",
      "renderer": "speedy_splat",
      "resolution_name": "720p",
      "width": 1280,
      "height": 720,
      "mean_fps": 71.2,
      "mean_latency_ms": 14.04088888888889,
      "p99_latency_ms": 16.6307,
      "peak_vram_mb": 3362.5,
      "stability_score": 0.8231764147029288,
      "source_json": "data\\results\\mipnerf360_garden_720p_2026-07-15\\benchmark_results.json"
    },
    {
      "scene_id": "garden",
      "renderer": "speedy_splat",
      "resolution_name": "1080p",
      "width": 1920,
      "height": 1080,
      "mean_fps": 61.9,
      "mean_latency_ms": 16.15611111111111,
      "p99_latency_ms": 22.2444,
      "peak_vram_mb": 3423.3,
      "stability_score": 0.7197317077556598,
      "source_json": "data\\results\\mipnerf360_garden_1080p_2026-07-15\\benchmark_results.json"
    },
    {
      "scene_id": "garden",
      "renderer": "speedy_splat",
      "resolution_name": "4k",
      "width": 3840,
      "height": 2160,
      "mean_fps": 38.7,
      "mean_latency_ms": 25.84,
      "p99_latency_ms": 30.7899,
      "peak_vram_mb": 3706.8,
      "stability_score": 0.8238091062328882,
      "source_json": "data\\results\\mipnerf360_garden_4k_2026-07-15\\benchmark_results.json"
    },
    {
      "scene_id": "bicycle",
      "renderer": "gsplat_higs_auto",
      "resolution_name": "720p",
      "width": 1280,
      "height": 720,
      "mean_fps": 255.6,
      "mean_latency_ms": 3.9128888888888893,
      "p99_latency_ms": 4.998799999999999,
      "peak_vram_mb": 2744.0,
      "stability_score": 0.7721853244778748,
      "source_json": "data\\results\\mipnerf360_bicycle_720p_2026-07-15\\benchmark_results.json"
    },
    {
      "scene_id": "bicycle",
      "renderer": "gsplat_higs_auto",
      "resolution_name": "1080p",
      "width": 1920,
      "height": 1080,
      "mean_fps": 245.9,
      "mean_latency_ms": 4.067111111111111,
      "p99_latency_ms": 7.704899999999998,
      "peak_vram_mb": 2776.1,
      "stability_score": 0.489299017508339,
      "source_json": "data\\results\\mipnerf360_bicycle_1080p_2026-07-15\\benchmark_results.json"
    },
    {
      "scene_id": "bicycle",
      "renderer": "gsplat_higs_auto",
      "resolution_name": "4k",
      "width": 3840,
      "height": 2160,
      "mean_fps": 124.8,
      "mean_latency_ms": 8.013666666666666,
      "p99_latency_ms": 98.81599999999999,
      "peak_vram_mb": 2932.6,
      "stability_score": 0.05282545336787566,
      "source_json": "data\\results\\mipnerf360_bicycle_4k_2026-07-15\\benchmark_results.json"
    },
    {
      "scene_id": "bicycle",
      "renderer": "speedy_splat",
      "resolution_name": "720p",
      "width": 1280,
      "height": 720,
      "mean_fps": 76.2,
      "mean_latency_ms": 13.131222222222224,
      "p99_latency_ms": 16.5639,
      "peak_vram_mb": 3522.1,
      "stability_score": 0.7679350877510731,
      "source_json": "data\\results\\mipnerf360_bicycle_720p_2026-07-15\\benchmark_results.json"
    },
    {
      "scene_id": "bicycle",
      "renderer": "speedy_splat",
      "resolution_name": "1080p",
      "width": 1920,
      "height": 1080,
      "mean_fps": 56.3,
      "mean_latency_ms": 17.752333333333333,
      "p99_latency_ms": 24.2665,
      "peak_vram_mb": 3588.8,
      "stability_score": 0.7090021222673232,
      "source_json": "data\\results\\mipnerf360_bicycle_1080p_2026-07-15\\benchmark_results.json"
    },
    {
      "scene_id": "bicycle",
      "renderer": "speedy_splat",
      "resolution_name": "4k",
      "width": 3840,
      "height": 2160,
      "mean_fps": 39.7,
      "mean_latency_ms": 25.217555555555556,
      "p99_latency_ms": 33.2842,
      "peak_vram_mb": 3885.2,
      "stability_score": 0.731428125056333,
      "source_json": "data\\results\\mipnerf360_bicycle_4k_2026-07-15\\benchmark_results.json"
    },
    {
      "scene_id": "room",
      "renderer": "gsplat_higs_auto",
      "resolution_name": "720p",
      "width": 1280,
      "height": 720,
      "mean_fps": 870.6,
      "mean_latency_ms": 1.1486666666666667,
      "p99_latency_ms": 1.4533,
      "peak_vram_mb": 758.4,
      "stability_score": 0.8050643363379894,
      "source_json": "data\\results\\mipnerf360_room_720p_2026-07-15\\benchmark_results.json"
    },
    {
      "scene_id": "room",
      "renderer": "gsplat_higs_auto",
      "resolution_name": "1080p",
      "width": 1920,
      "height": 1080,
      "mean_fps": 489.8,
      "mean_latency_ms": 2.041555555555555,
      "p99_latency_ms": 2.801,
      "peak_vram_mb": 786.2,
      "stability_score": 0.7318814709032487,
      "source_json": "data\\results\\mipnerf360_room_1080p_2026-07-15\\benchmark_results.json"
    },
    {
      "scene_id": "room",
      "renderer": "gsplat_higs_auto",
      "resolution_name": "4k",
      "width": 3840,
      "height": 2160,
      "mean_fps": 318.9,
      "mean_latency_ms": 3.1356666666666673,
      "p99_latency_ms": 3.8455,
      "peak_vram_mb": 915.8,
      "stability_score": 0.8165388115979717,
      "source_json": "data\\results\\mipnerf360_room_4k_2026-07-15\\benchmark_results.json"
    },
    {
      "scene_id": "room",
      "renderer": "speedy_splat",
      "resolution_name": "720p",
      "width": 1280,
      "height": 720,
      "mean_fps": 277.5,
      "mean_latency_ms": 3.603777777777778,
      "p99_latency_ms": 4.5211,
      "peak_vram_mb": 983.7,
      "stability_score": 0.8172789807790141,
      "source_json": "data\\results\\mipnerf360_room_720p_2026-07-15\\benchmark_results.json"
    },
    {
      "scene_id": "room",
      "renderer": "speedy_splat",
      "resolution_name": "1080p",
      "width": 1920,
      "height": 1080,
      "mean_fps": 176.4,
      "mean_latency_ms": 5.668777777777779,
      "p99_latency_ms": 9.0472,
      "peak_vram_mb": 1047.1,
      "stability_score": 0.6012910071624369,
      "source_json": "data\\results\\mipnerf360_room_1080p_2026-07-15\\benchmark_results.json"
    },
    {
      "scene_id": "room",
      "renderer": "speedy_splat",
      "resolution_name": "4k",
      "width": 3840,
      "height": 2160,
      "mean_fps": 89.7,
      "mean_latency_ms": 11.142111111111111,
      "p99_latency_ms": 12.7965,
      "peak_vram_mb": 1350.4,
      "stability_score": 0.8807095690227796,
      "source_json": "data\\results\\mipnerf360_room_4k_2026-07-15\\benchmark_results.json"
    }
  ]
}